{
  "id": "trans:generic:example-collection:example-book:taml:indic-transliteration",
  "bookId": "example-book",
  "title": "Example Book of Harmony",
  "religion": "Generic",
  "collection": "Example Collection",
  "book": "Example Book of Harmony",
  "targetLanguage": "Sanskrit (Tamil)",
  "targetScript": "Taml",
  "translator": "indic-transliteration",
  "year": 2026,
  "license": "Public Domain",
  "source": "Auto-transliterated from IAST using indic-transliteration library (Fictional Demonstration Corpus)",
  "totalChapters": 1,
  "totalVerses": 3,
  "chapters": [
    {
      "number": 1,
      "title": "Chapter 1",
      "totalVerses": 3,
      "verses": [
        {
          "verseId": "generic:example-collection:example-book:1.1",
          "verse": 1,
          "citation": "1.1",
          "text": "சோந்சோர்திஅ பர்வஏ ரேஸ் ச்ரேஸ்சுந்த், திஸ்சோர்திஅ மxஇமஏ திலபுந்துர்.",
          "notes": null
        },
        {
          "verseId": "generic:example-collection:example-book:1.2",
          "verse": 2,
          "citation": "1.2",
          "text": "வேரிதஸ் வோஸ் லிபேரபித் ஏத் ஸபிஏந்திஅ பசேம் ஃபேரேத்.",
          "notes": null
        },
        {
          "verseId": "generic:example-collection:example-book:1.3",
          "verse": 3,
          "citation": "1.3",
          "text": "அமோர் ஏத் ஸ்சிஏந்திஅ முந்தும் ஸுஸ்திநேந்த்.",
          "notes": null
        }
      ]
    }
  ]
}