{
  "id": "trans:generic:example-collection:example-book:deva:indic-transliteration",
  "bookId": "example-book",
  "title": "Example Book of Harmony",
  "religion": "Generic",
  "collection": "Example Collection",
  "book": "Example Book of Harmony",
  "targetLanguage": "Sanskrit (Devanagari)",
  "targetScript": "Deva",
  "translator": "indic-transliteration",
  "year": 2026,
  "license": "Public Domain",
  "source": "Auto-transliterated from IAST using indic-transliteration library (Fictional Demonstration Corpus)",
  "totalChapters": 1,
  "totalVerses": 3,
  "chapters": [
    {
      "number": 1,
      "title": "Chapter 1",
      "totalVerses": 3,
      "verses": [
        {
          "verseId": "generic:example-collection:example-book:1.1",
          "verse": 1,
          "citation": "1.1",
          "text": "चोन्चोर्दिअ पर्वए रेस् च्रेस्चुन्त्, दिस्चोर्दिअ मxइमए दिलबुन्तुर्.",
          "notes": null
        },
        {
          "verseId": "generic:example-collection:example-book:1.2",
          "verse": 2,
          "citation": "1.2",
          "text": "वेरितस् वोस् लिबेरबित् एत् सपिएन्तिअ पचेम् फ़ेरेत्.",
          "notes": null
        },
        {
          "verseId": "generic:example-collection:example-book:1.3",
          "verse": 3,
          "citation": "1.3",
          "text": "अमोर् एत् स्चिएन्तिअ मुन्दुम् सुस्तिनेन्त्.",
          "notes": null
        }
      ]
    }
  ]
}