{
  "id": "trans:generic:example-collection:example-book:orya:indic-transliteration",
  "bookId": "example-book",
  "title": "Example Book of Harmony",
  "religion": "Generic",
  "collection": "Example Collection",
  "book": "Example Book of Harmony",
  "targetLanguage": "Sanskrit (Odia)",
  "targetScript": "Orya",
  "translator": "indic-transliteration",
  "year": 2026,
  "license": "Public Domain",
  "source": "Auto-transliterated from IAST using indic-transliteration library (Fictional Demonstration Corpus)",
  "totalChapters": 1,
  "totalVerses": 3,
  "chapters": [
    {
      "number": 1,
      "title": "Chapter 1",
      "totalVerses": 3,
      "verses": [
        {
          "verseId": "generic:example-collection:example-book:1.1",
          "verse": 1,
          "citation": "1.1",
          "text": "ଚୋନ୍ଚୋର୍ଦିଅ ପର୍ଵଏ ରେସ୍ ଚ୍ରେସ୍ଚୁନ୍ତ୍, ଦିସ୍ଚୋର୍ଦିଅ ମxଇମଏ ଦିଲବୁନ୍ତୁର୍.",
          "notes": null
        },
        {
          "verseId": "generic:example-collection:example-book:1.2",
          "verse": 2,
          "citation": "1.2",
          "text": "ଵେରିତସ୍ ଵୋସ୍ ଲିବେରବିତ୍ ଏତ୍ ସପିଏନ୍ତିଅ ପଚେମ୍ ଫ଼େରେତ୍.",
          "notes": null
        },
        {
          "verseId": "generic:example-collection:example-book:1.3",
          "verse": 3,
          "citation": "1.3",
          "text": "ଅମୋର୍ ଏତ୍ ସ୍ଚିଏନ୍ତିଅ ମୁନ୍ଦୁମ୍ ସୁସ୍ତିନେନ୍ତ୍.",
          "notes": null
        }
      ]
    }
  ]
}