{
  "id": "trans:generic:example-collection:example-book:mlym:indic-transliteration",
  "bookId": "example-book",
  "title": "Example Book of Harmony",
  "religion": "Generic",
  "collection": "Example Collection",
  "book": "Example Book of Harmony",
  "targetLanguage": "Sanskrit (Malayalam)",
  "targetScript": "Mlym",
  "translator": "indic-transliteration",
  "year": 2026,
  "license": "Public Domain",
  "source": "Auto-transliterated from IAST using indic-transliteration library (Fictional Demonstration Corpus)",
  "totalChapters": 1,
  "totalVerses": 3,
  "chapters": [
    {
      "number": 1,
      "title": "Chapter 1",
      "totalVerses": 3,
      "verses": [
        {
          "verseId": "generic:example-collection:example-book:1.1",
          "verse": 1,
          "citation": "1.1",
          "text": "ചോന്ചോര്ദിഅ പര്വഏ രേസ് ച്രേസ്ചുന്ത്, ദിസ്ചോര്ദിഅ മxഇമഏ ദിലബുന്തുര്.",
          "notes": null
        },
        {
          "verseId": "generic:example-collection:example-book:1.2",
          "verse": 2,
          "citation": "1.2",
          "text": "വേരിതസ് വോസ് ലിബേരബിത് ഏത് സപിഏന്തിഅ പചേമ് fേരേത്.",
          "notes": null
        },
        {
          "verseId": "generic:example-collection:example-book:1.3",
          "verse": 3,
          "citation": "1.3",
          "text": "അമോര് ഏത് സ്ചിഏന്തിഅ മുന്ദുമ് സുസ്തിനേന്ത്.",
          "notes": null
        }
      ]
    }
  ]
}