{
  "id": "trans:generic:example-collection:example-book:srbc:indic-transliteration",
  "bookId": "example-book",
  "title": "Example Book of Harmony",
  "religion": "Generic",
  "collection": "Example Collection",
  "book": "Example Book of Harmony",
  "targetLanguage": "Sanskrit (Sharada)",
  "targetScript": "Srbc",
  "translator": "indic-transliteration",
  "year": 2026,
  "license": "Public Domain",
  "source": "Auto-transliterated from IAST using indic-transliteration library (Fictional Demonstration Corpus)",
  "totalChapters": 1,
  "totalVerses": 3,
  "chapters": [
    {
      "number": 1,
      "title": "Chapter 1",
      "totalVerses": 3,
      "verses": [
        {
          "verseId": "generic:example-collection:example-book:1.1",
          "verse": 1,
          "citation": "1.1",
          "text": "𑆖𑆾𑆤𑇀𑆖𑆾𑆫𑇀𑆢𑆴𑆃 𑆥𑆫𑇀𑆮𑆍 𑆫𑆼𑆱𑇀 𑆖𑇀𑆫𑆼𑆱𑇀𑆖𑆶𑆤𑇀𑆠𑇀, 𑆢𑆴𑆱𑇀𑆖𑆾𑆫𑇀𑆢𑆴𑆃 𑆩x𑆅𑆩𑆍 𑆢𑆴𑆬𑆧𑆶𑆤𑇀𑆠𑆶𑆫𑇀.",
          "notes": null
        },
        {
          "verseId": "generic:example-collection:example-book:1.2",
          "verse": 2,
          "citation": "1.2",
          "text": "𑆮𑆼𑆫𑆴𑆠𑆱𑇀 𑆮𑆾𑆱𑇀 𑆬𑆴𑆧𑆼𑆫𑆧𑆴𑆠𑇀 𑆍𑆠𑇀 𑆱𑆥𑆴𑆍𑆤𑇀𑆠𑆴𑆃 𑆥𑆖𑆼𑆩𑇀 𑆦𑇊𑆼𑆫𑆼𑆠𑇀.",
          "notes": null
        },
        {
          "verseId": "generic:example-collection:example-book:1.3",
          "verse": 3,
          "citation": "1.3",
          "text": "𑆃𑆩𑆾𑆫𑇀 𑆍𑆠𑇀 𑆱𑇀𑆖𑆴𑆍𑆤𑇀𑆠𑆴𑆃 𑆩𑆶𑆤𑇀𑆢𑆶𑆩𑇀 𑆱𑆶𑆱𑇀𑆠𑆴𑆤𑆼𑆤𑇀𑆠𑇀.",
          "notes": null
        }
      ]
    }
  ]
}