{
  "id": "trans:generic:example-collection:example-book:gran:indic-transliteration",
  "bookId": "example-book",
  "title": "Example Book of Harmony",
  "religion": "Generic",
  "collection": "Example Collection",
  "book": "Example Book of Harmony",
  "targetLanguage": "Sanskrit (Grantha)",
  "targetScript": "Gran",
  "translator": "indic-transliteration",
  "year": 2026,
  "license": "Public Domain",
  "source": "Auto-transliterated from IAST using indic-transliteration library (Fictional Demonstration Corpus)",
  "totalChapters": 1,
  "totalVerses": 3,
  "chapters": [
    {
      "number": 1,
      "title": "Chapter 1",
      "totalVerses": 3,
      "verses": [
        {
          "verseId": "generic:example-collection:example-book:1.1",
          "verse": 1,
          "citation": "1.1",
          "text": "𑌚𑍋𑌨𑍍𑌚𑍋𑌰𑍍𑌦𑌿𑌅 𑌪𑌰𑍍𑌵𑌏 𑌰𑍇𑌸𑍍 𑌚𑍍𑌰𑍇𑌸𑍍𑌚𑍁𑌨𑍍𑌤𑍍, 𑌦𑌿𑌸𑍍𑌚𑍋𑌰𑍍𑌦𑌿𑌅 𑌮x𑌇𑌮𑌏 𑌦𑌿𑌲𑌬𑍁𑌨𑍍𑌤𑍁𑌰𑍍.",
          "notes": null
        },
        {
          "verseId": "generic:example-collection:example-book:1.2",
          "verse": 2,
          "citation": "1.2",
          "text": "𑌵𑍇𑌰𑌿𑌤𑌸𑍍 𑌵𑍋𑌸𑍍 𑌲𑌿𑌬𑍇𑌰𑌬𑌿𑌤𑍍 𑌏𑌤𑍍 𑌸𑌪𑌿𑌏𑌨𑍍𑌤𑌿𑌅 𑌪𑌚𑍇𑌮𑍍 𑌫𑌼𑍇𑌰𑍇𑌤𑍍.",
          "notes": null
        },
        {
          "verseId": "generic:example-collection:example-book:1.3",
          "verse": 3,
          "citation": "1.3",
          "text": "𑌅𑌮𑍋𑌰𑍍 𑌏𑌤𑍍 𑌸𑍍𑌚𑌿𑌏𑌨𑍍𑌤𑌿𑌅 𑌮𑍁𑌨𑍍𑌦𑍁𑌮𑍍 𑌸𑍁𑌸𑍍𑌤𑌿𑌨𑍇𑌨𑍍𑌤𑍍.",
          "notes": null
        }
      ]
    }
  ]
}