{
  "id": "trans:generic:example-collection:example-book:guru:indic-transliteration",
  "bookId": "example-book",
  "title": "Example Book of Harmony",
  "religion": "Generic",
  "collection": "Example Collection",
  "book": "Example Book of Harmony",
  "targetLanguage": "Sanskrit (Gurmukhi)",
  "targetScript": "Guru",
  "translator": "indic-transliteration",
  "year": 2026,
  "license": "Public Domain",
  "source": "Auto-transliterated from IAST using indic-transliteration library (Fictional Demonstration Corpus)",
  "totalChapters": 1,
  "totalVerses": 3,
  "chapters": [
    {
      "number": 1,
      "title": "Chapter 1",
      "totalVerses": 3,
      "verses": [
        {
          "verseId": "generic:example-collection:example-book:1.1",
          "verse": 1,
          "citation": "1.1",
          "text": "ਚੋਨ੍ਚੋਰ੍ਦਿਅ ਪਰ੍ਵਏ ਰੇਸ੍ ਚ੍ਰੇਸ੍ਚੁਨ੍ਤ੍, ਦਿਸ੍ਚੋਰ੍ਦਿਅ ਮxਇਮਏ ਦਿਲਬੁਨ੍ਤੁਰ੍.",
          "notes": null
        },
        {
          "verseId": "generic:example-collection:example-book:1.2",
          "verse": 2,
          "citation": "1.2",
          "text": "ਵੇਰਿਤਸ੍ ਵੋਸ੍ ਲਿਬੇਰਬਿਤ੍ ਏਤ੍ ਸਪਿਏਨ੍ਤਿਅ ਪਚੇਮ੍ ਫ਼ੇਰੇਤ੍.",
          "notes": null
        },
        {
          "verseId": "generic:example-collection:example-book:1.3",
          "verse": 3,
          "citation": "1.3",
          "text": "ਅਮੋਰ੍ ਏਤ੍ ਸ੍ਚਿਏਨ੍ਤਿਅ ਮੁਨ੍ਦੁਮ੍ ਸੁਸ੍ਤਿਨੇਨ੍ਤ੍.",
          "notes": null
        }
      ]
    }
  ]
}