{
  "id": "trans:generic:example-collection:example-book:beng:indic-transliteration",
  "bookId": "example-book",
  "title": "Example Book of Harmony",
  "religion": "Generic",
  "collection": "Example Collection",
  "book": "Example Book of Harmony",
  "targetLanguage": "Sanskrit (Bengali)",
  "targetScript": "Beng",
  "translator": "indic-transliteration",
  "year": 2026,
  "license": "Public Domain",
  "source": "Auto-transliterated from IAST using indic-transliteration library (Fictional Demonstration Corpus)",
  "totalChapters": 1,
  "totalVerses": 3,
  "chapters": [
    {
      "number": 1,
      "title": "Chapter 1",
      "totalVerses": 3,
      "verses": [
        {
          "verseId": "generic:example-collection:example-book:1.1",
          "verse": 1,
          "citation": "1.1",
          "text": "চোন্চোর্দিঅ পর্বএ রেস্ চ্রেস্চুন্ত্, দিস্চোর্দিঅ মxইমএ দিলবুন্তুর্.",
          "notes": null
        },
        {
          "verseId": "generic:example-collection:example-book:1.2",
          "verse": 2,
          "citation": "1.2",
          "text": "বেরিতস্ বোস্ লিবেরবিত্ এত্ সপিএন্তিঅ পচেম্ ফ়েরেত্.",
          "notes": null
        },
        {
          "verseId": "generic:example-collection:example-book:1.3",
          "verse": 3,
          "citation": "1.3",
          "text": "অমোর্ এত্ স্চিএন্তিঅ মুন্দুম্ সুস্তিনেন্ত্.",
          "notes": null
        }
      ]
    }
  ]
}