{
  "id": "trans:generic:example-collection:example-book:en:crine",
  "bookId": "example-book",
  "title": "Example Book of Harmony",
  "religion": "Generic",
  "collection": "Example Collection",
  "book": "Example Book of Harmony",
  "targetLanguage": "English",
  "targetScript": "Latn",
  "translator": "CRINE Open Archive Team",
  "year": 2026,
  "license": "Public Domain",
  "source": "Fictional Demonstration Translation",
  "totalChapters": 1,
  "totalVerses": 3,
  "chapters": [
    {
      "number": 1,
      "title": "Chapter 1",
      "totalVerses": 3,
      "verses": [
        {
          "verseId": "generic:example-collection:example-book:1.1",
          "chapter": 1,
          "verse": 1,
          "citation": "1.1",
          "text": "Through harmony small things grow, through discord the greatest things decay.",
          "notes": "Classical proverb translation."
        },
        {
          "verseId": "generic:example-collection:example-book:1.2",
          "chapter": 1,
          "verse": 2,
          "citation": "1.2",
          "text": "Truth shall set you free and wisdom shall bring peace.",
          "notes": "Demonstration translation."
        },
        {
          "verseId": "generic:example-collection:example-book:1.3",
          "chapter": 1,
          "verse": 3,
          "citation": "1.3",
          "text": "Love and knowledge sustain the world.",
          "notes": "Demonstration translation."
        }
      ]
    }
  ]
}
