{
  "id": "trans:generic:example-collection:example-book:telu:indic-transliteration",
  "bookId": "example-book",
  "title": "Example Book of Harmony",
  "religion": "Generic",
  "collection": "Example Collection",
  "book": "Example Book of Harmony",
  "targetLanguage": "Sanskrit (Telugu)",
  "targetScript": "Telu",
  "translator": "indic-transliteration",
  "year": 2026,
  "license": "Public Domain",
  "source": "Auto-transliterated from IAST using indic-transliteration library (Fictional Demonstration Corpus)",
  "totalChapters": 1,
  "totalVerses": 3,
  "chapters": [
    {
      "number": 1,
      "title": "Chapter 1",
      "totalVerses": 3,
      "verses": [
        {
          "verseId": "generic:example-collection:example-book:1.1",
          "verse": 1,
          "citation": "1.1",
          "text": "చోన్చోర్దిఅ పర్వఏ రేస్ చ్రేస్చున్త్, దిస్చోర్దిఅ మxఇమఏ దిలబున్తుర్.",
          "notes": null
        },
        {
          "verseId": "generic:example-collection:example-book:1.2",
          "verse": 2,
          "citation": "1.2",
          "text": "వేరితస్ వోస్ లిబేరబిత్ ఏత్ సపిఏన్తిఅ పచేమ్ fేరేత్.",
          "notes": null
        },
        {
          "verseId": "generic:example-collection:example-book:1.3",
          "verse": 3,
          "citation": "1.3",
          "text": "అమోర్ ఏత్ స్చిఏన్తిఅ మున్దుమ్ సుస్తినేన్త్.",
          "notes": null
        }
      ]
    }
  ]
}