{
  "id": "trans:generic:example-collection:example-book:knda:indic-transliteration",
  "bookId": "example-book",
  "title": "Example Book of Harmony",
  "religion": "Generic",
  "collection": "Example Collection",
  "book": "Example Book of Harmony",
  "targetLanguage": "Sanskrit (Kannada)",
  "targetScript": "Knda",
  "translator": "indic-transliteration",
  "year": 2026,
  "license": "Public Domain",
  "source": "Auto-transliterated from IAST using indic-transliteration library (Fictional Demonstration Corpus)",
  "totalChapters": 1,
  "totalVerses": 3,
  "chapters": [
    {
      "number": 1,
      "title": "Chapter 1",
      "totalVerses": 3,
      "verses": [
        {
          "verseId": "generic:example-collection:example-book:1.1",
          "verse": 1,
          "citation": "1.1",
          "text": "ಚೋನ್ಚೋರ್ದಿಅ ಪರ್ವಏ ರೇಸ್ ಚ್ರೇಸ್ಚುನ್ತ್, ದಿಸ್ಚೋರ್ದಿಅ ಮxಇಮಏ ದಿಲಬುನ್ತುರ್.",
          "notes": null
        },
        {
          "verseId": "generic:example-collection:example-book:1.2",
          "verse": 2,
          "citation": "1.2",
          "text": "ವೇರಿತಸ್ ವೋಸ್ ಲಿಬೇರಬಿತ್ ಏತ್ ಸಪಿಏನ್ತಿಅ ಪಚೇಮ್ ಫ಼ೇರೇತ್.",
          "notes": null
        },
        {
          "verseId": "generic:example-collection:example-book:1.3",
          "verse": 3,
          "citation": "1.3",
          "text": "ಅಮೋರ್ ಏತ್ ಸ್ಚಿಏನ್ತಿಅ ಮುನ್ದುಮ್ ಸುಸ್ತಿನೇನ್ತ್.",
          "notes": null
        }
      ]
    }
  ]
}